after few months of experience,4,YGal,April/4/2017,Style:Trainer,否,The old say - "It is not the product it is me".I purchased this unit few month ago convincing myself that summer is coming and while it is gonna be too hot I will use this trainer in my living room in front of the TV and do my exercise.Of course - I didn't - just a matter of laziness.Winter came and now I forced myself to use it - It was really great experience. Unit is working flawless and you find the right exercises (YouTube / cycleops) - you don't even feel how the time pass (I will admit - I never use it more than an hour - but I assume I could extend it to a longer time.I'm using the Garmin 705 on my bike with the full set of accessories  - so at the end of the practice I have a full statistic of the distance the speed  Cadence sensor and HR measurement.Unit is working great and I would give it 5 stars - but gave it only 4 as a result of :1. You have to be strong and really force yourself to ride at home - many of my friends bought it and almost never use it - so think twice before spending the money .2. Better to have it with rear wheel speedometer (Garmin Edge 705 - worked great for me) as it give you the right statistic and motivation3. Use it in front of big screen and picked the right show to watch - if not it is really boring4. Keep your old tires - better to use them and not your good one .And now when the spring come - hope to see the results riding outside  - Safe ride !!!,0
It should list that it comes with a trainer skewer ...,3,Amazon Customer,December/28/2017,Style:Trainer,有,It should list that it comes with a trainer skewer.  As a result of this not being listed I bought a skewer and ended up with one I didn't need.,0
Great trainer gift,5,Zain,January/5/2017,Style:Trainer,有,This was a gift and the recipient was very happy with how quiet it is and the ease of set up.,2
The Trainer Works Well,5,Saeed M,November/11/2014,Style:Trainer,否,I am new to trainers so I can't compare to much else but my experience with this machine has been flawless.  It does very much feel like riding out on a regular road surface and the assembly was straight forward and easy.,2
Five Stars,5,hjd,March/1/2016,Style:Trainer,有,Excellent bike trainer....,0
Five Stars,5,j,February/8/2016,Style:Trainer,有,excellent bike trainer!,0
Works great!,5,LLC,September/26/2016,Style:Trainer,有,Awesome,0
Five Stars,5,Sisu145,January/31/2016,Style:Trainer,有,Works great! Good price and fast shipping. Wife loves it.,0
Five Stars,5,DAVID SIMONI,February/27/2016,Style:Trainer,有,This bike trainer is really great.  It set up easy and provides a worthwhile workout.,0
Awesome,5,GREGG,December/14/2017,Style:Trainer,有,as described. easy to assemble,0
Basic affordable solution,2,S.Welch,April/6/2017,Style:Trainer,否,This is a well built trainer that is easy to set up.  It's not the most aggressive ride the resistance is not adjustable this would not be a trainer that you can grow into as your level of fitness increases.  It gets the job done for an indoor ride with few bells and whistles.,One
Easy setup and works fine so far,5,Doug,December/12/2017,Style:Trainer,有,Item arrived on time.  Easy setup and works fine so far.,0
Five Stars,5,cmt,August/8/2016,Style:Trainer,有,Great item shipped fast.,0
Not Ideal for 29-inch wheels,2,Jenn,December/29/2015,Style:Trainer,否,I tried this out on my Specialized Hardrock 29er and wound up returning it. While technically it fits the tire still rubs on the tile floor. And when you use this (or any other trainer) with a mountain bike - even with hybrid wheels - trainers are LOUD. I mean LOUD. Forget watching TV while on this. You would need high quality full-coverage headphones blasting heavy metal to counteract the noise. If that's your kind of biking then this trainer is perfect for you. Me? Not so much.,One
Five Stars,5,Haraldur,February/29/2016,Style:Trainer,有,Works lik a charm.,0
Five Stars,5,Mike S.,January/17/2017,Style:Trainer,有,So far so good fantastic bike trainer!,0
I wasn't happy with it because it felt nothing like a stationary ...,1,Carolyn Sue Zallar,April/2/2016,Style:Trainer,有,I wasn't happy with it because it felt nothing like a stationary bike from the gym it forced me to slope forward and it was incredibly loud.,2
Very POOR Instructions,1,Amzn Cust Ace,January/3/2015,Style:Trainer,有,Assembly instructions poorly written - middle school student's could write much better instructions.  After spending this kind of money on a professional item it's not worth it to fight to figure out how to assemble the unit and install a bike to it.,2
Get the roller trainer instead and use the gears to adjust the resistance,2,Champ Tech,June/5/2017,Style:Trainer,否,Admitting I don't own one but I'm an old school cyclist who spent hundreds and hundreds of hours on the roller trainer and this trainer is more like for sissy cyclists (sorry if i's offending some of you). The roller trainers teach you how to ride in a straight line so it becomes as a second nature (of course after spending many many hours on the roller trainer). So now I can easily ride my bike on the roller trainer and not holding the handle bar and of course not keeping the trainer in the door way. Sure I don't keep it on the middle of the gym these days as we had to back than when I was on the pro team.,0
